{
  "triage_line": "Construir: un paso.",
  "closing_risk": "none",
  "note": "Paso de prueba.",
  "new_decisions": [
    {
      "id": "new-1",
      "statement": "Comparar por veces.",
      "instead_of": "Comparar por conteos crudos.",
      "would_choose_if": "Los estudios usaran el mismo filtro.",
      "assumption": false,
      "used_in_sections": [
        "sec-1"
      ]
    }
  ],
  "new_text": [
    {
      "section_id": "sec-1",
      "base_version": 1,
      "anchor": "Cierre.",
      "operation": "insert_after",
      "text": " Según new-1, comparamos."
    }
  ]
}
